{
  "timestamp_utc": "2026-03-24T06:56:29.631479+00:00",
  "report_type": "benchmark_ids",
  "report_schema_version": "1.0",
  "deployment_config": {
    "light_model_path": "models/student_tiny_improved.pth",
    "heavy_model_path": "models/heavy_rf.joblib",
    "onnx_model_path": "models/student_tiny_improved.onnx",
    "can_window_size": 100,
    "eth_window_size": 1,
    "routing_threshold": 0.0001,
    "latency_budget_ms": 100.0,
    "fpr_budget": 0.05,
    "fail_safe_mode": "degraded",
    "model_integrity_sha256": "57d2445d04b7f63f0c36ab3c3db70da65d604f613be627f9fef6e2bfc26ef1fc",
    "can_source": "datasets/can_dos_train.csv",
    "eth_source": "datasets/replica_eth_smoke/eth_driving_01_injected_replica_packets.csv",
    "alert_output_path": "logs/runtime_alerts.jsonl",
    "use_onnx": true,
    "max_samples": 500
  },
  "benchmark_report": {
    "latency_p50_ms": 0.21135807037353516,
    "latency_p95_ms": 0.3152966499328612,
    "latency_max_ms": 2.4971961975097656,
    "fpr": 0.0,
    "fnr": 0.0,
    "mcc": 0.0,
    "cpu_percent": 18.3,
    "memory_mb": 647.16015625,
    "power_watts": null,
    "hardware_id": "AMD64",
    "os": "Windows-11-10.0.26200-SP0",
    "model_hash": "57d2445d04b7f63f0c36ab3c3db70da65d604f613be627f9fef6e2bfc26ef1fc",
    "total_samples": 500,
    "deadline_ms": 100.0,
    "deadline_miss_rate": 0.0
  }
}